{
  "schema_version": 2,
  "id": "binary/composer",
  "kind": "binary",
  "name": "composer",
  "revision": "1.0.0",
  "purpose": "Exact upstream Composer PHAR for a target that already has compatible PHP CLI.",
  "capabilities": ["software:composer", "package-management:php"],
  "targets": ["linux/amd64"],
  "prerequisites": {
    "commands": ["php"],
    "requirements": [
      "PHP CLI 7.2.5 or later with PHAR support; this resource does not install PHP.",
      "The consuming project's extensions, services, archive tools and dependencies remain explicit."
    ]
  },
  "documentation": "docs/resources/binary-composer.md",
  "details": {
    "upstream_version": "2.10.3",
    "source_url": "https://getcomposer.org/download/2.10.3/composer.phar",
    "sha256": "7a2d379d5b8ffdaa028580ef26494c36d2feef4b178d3dd1473a4dbc5e17c8d6",
    "filename": "composer.phar",
    "executable": "bin/composer.phar"
  },
  "verification": {
    "command": ["bash", "scripts/xorder/verify-composer.sh"]
  }
}
